Author,Quote
Albert Einstein,“The world as we have created it is a process of our thinking. It cannot be changed without changing our thinking.”
J.K. Rowling,"“It is our choices, Harry, that show what we truly are, far more than our abilities.”"
Albert Einstein,“There are only two ways to live your life. One is as though nothing is a miracle. The other is as though everything is a miracle.”
Jane Austen,"“The person, be it gentleman or lady, who has not pleasure in a good novel, must be intolerably stupid.”"
Marilyn Monroe,"“Imperfection is beauty, madness is genius and it's better to be absolutely ridiculous than absolutely boring.”"
